{
  "version": "1.0.0",
  "generated": "2025-11-13T05:39:29.319Z",
  "components": [
    {
      "name": "drag-drop-list",
      "displayName": "Drag Drop List",
      "description": "Drag Drop List component",
      "category": "ui",
      "path": "../components/src/components/drag-drop-list.mjs",
      "icon": "üìù",
      "tags": [
        "ui",
        "drag"
      ],
      "status": "stable",
      "since": "1.0.0",
      "attributes": [
        {
          "name": "topic",
          "type": "string",
          "default": "",
          "description": "topic attribute",
          "required": false
        },
        {
          "name": "items",
          "type": "string",
          "default": "",
          "description": "items attribute",
          "required": false
        },
        {
          "name": "disabled",
          "type": "string",
          "default": "",
          "description": "disabled attribute",
          "required": false
        },
        {
          "name": "handle",
          "type": "string",
          "default": "",
          "description": "handle attribute",
          "required": false
        }
      ],
      "properties": [],
      "methods": [],
      "events": [],
      "slots": [],
      "examples": [],
      "dependencies": [
        "@larcjs/core"
      ],
      "related": []
    },
    {
      "name": "editable-cell",
      "displayName": "Editable Cell",
      "description": "Editable Cell component",
      "category": "forms",
      "path": "../components/src/components/editable-cell.mjs",
      "icon": "üì¶",
      "tags": [
        "forms",
        "editable"
      ],
      "status": "stable",
      "since": "1.0.0",
      "attributes": [
        {
          "name": "value",
          "type": "string",
          "default": "",
          "description": "value attribute",
          "required": false
        },
        {
          "name": "type",
          "type": "string",
          "default": "",
          "description": "type attribute",
          "required": false
        },
        {
          "name": "placeholder",
          "type": "string",
          "default": "",
          "description": "placeholder attribute",
          "required": false
        },
        {
          "name": "topic",
          "type": "string",
          "default": "",
          "description": "topic attribute",
          "required": false
        },
        {
          "name": "cell-id",
          "type": "string",
          "default": "",
          "description": "cell-id attribute",
          "required": false
        },
        {
          "name": "editable",
          "type": "string",
          "default": "",
          "description": "editable attribute",
          "required": false
        },
        {
          "name": "multiline",
          "type": "string",
          "default": "",
          "description": "multiline attribute",
          "required": false
        }
      ],
      "properties": [],
      "methods": [],
      "events": [],
      "slots": [],
      "examples": [],
      "dependencies": [
        "@larcjs/core"
      ],
      "related": []
    },
    {
      "name": "file-upload",
      "displayName": "File Upload",
      "description": "File Upload component",
      "category": "forms",
      "path": "../components/src/components/file-upload.mjs",
      "icon": "üì§",
      "tags": [
        "forms",
        "file"
      ],
      "status": "stable",
      "since": "1.0.0",
      "attributes": [
        {
          "name": "accept",
          "type": "string",
          "default": "",
          "description": "accept attribute",
          "required": false
        },
        {
          "name": "multiple",
          "type": "string",
          "default": "",
          "description": "multiple attribute",
          "required": false
        },
        {
          "name": "max-size",
          "type": "string",
          "default": "",
          "description": "max-size attribute",
          "required": false
        },
        {
          "name": "topic",
          "type": "string",
          "default": "",
          "description": "topic attribute",
          "required": false
        },
        {
          "name": "preview",
          "type": "string",
          "default": "",
          "description": "preview attribute",
          "required": false
        },
        {
          "name": "drag-drop",
          "type": "string",
          "default": "",
          "description": "drag-drop attribute",
          "required": false
        }
      ],
      "properties": [],
      "methods": [],
      "events": [],
      "slots": [],
      "examples": [],
      "dependencies": [
        "@larcjs/core"
      ],
      "related": []
    },
    {
      "name": "pan-auth",
      "displayName": "Pan Auth",
      "description": "Pan Auth component",
      "category": "auth",
      "path": "../components/src/components/pan-auth.mjs",
      "icon": "üîë",
      "tags": [
        "auth",
        "pan"
      ],
      "status": "stable",
      "since": "1.0.0",
      "attributes": [
        {
          "name": "storage",
          "type": "string",
          "default": "",
          "description": "storage attribute",
          "required": false
        },
        {
          "name": "token-key",
          "type": "string",
          "default": "",
          "description": "token-key attribute",
          "required": false
        },
        {
          "name": "refresh-key",
          "type": "string",
          "default": "",
          "description": "refresh-key attribute",
          "required": false
        },
        {
          "name": "auto-refresh",
          "type": "string",
          "default": "",
          "description": "auto-refresh attribute",
          "required": false
        },
        {
          "name": "refresh-before",
          "type": "string",
          "default": "",
          "description": "refresh-before attribute",
          "required": false
        },
        {
          "name": "login-endpoint",
          "type": "string",
          "default": "",
          "description": "login-endpoint attribute",
          "required": false
        },
        {
          "name": "refresh-endpoint",
          "type": "string",
          "default": "",
          "description": "refresh-endpoint attribute",
          "required": false
        }
      ],
      "properties": [],
      "methods": [],
      "events": [],
      "slots": [],
      "examples": [],
      "dependencies": [
        "@larcjs/core"
      ],
      "related": []
    },
    {
      "name": "pan-bus",
      "displayName": "Pan Bus",
      "description": "PAN Bus - Central message bus for Page Area Network communication",
      "category": "advanced",
      "path": "../components/src/components/pan-bus-legacy.mjs",
      "icon": "üì¶",
      "tags": [
        "advanced",
        "pan"
      ],
      "status": "stable",
      "since": "1.0.0",
      "attributes": [],
      "properties": [],
      "methods": [],
      "events": [],
      "slots": [],
      "examples": [],
      "dependencies": [
        "@larcjs/core"
      ],
      "related": []
    },
    {
      "name": "pan-bus-enhanced",
      "displayName": "Pan Bus Enhanced",
      "description": "PAN Bus (Enhanced) - Central message bus with memory management and security",
      "category": "advanced",
      "path": "../components/src/components/pan-bus-enhanced.mjs",
      "icon": "üì¶",
      "tags": [
        "advanced",
        "pan"
      ],
      "status": "stable",
      "since": "1.0.0",
      "attributes": [
        {
          "name": "max-retained",
          "type": "string",
          "default": "",
          "description": "max-retained attribute",
          "required": false
        },
        {
          "name": "max-message-size",
          "type": "string",
          "default": "",
          "description": "max-message-size attribute",
          "required": false
        },
        {
          "name": "max-payload-size",
          "type": "string",
          "default": "",
          "description": "max-payload-size attribute",
          "required": false
        },
        {
          "name": "cleanup-interval",
          "type": "string",
          "default": "",
          "description": "cleanup-interval attribute",
          "required": false
        },
        {
          "name": "rate-limit",
          "type": "string",
          "default": "",
          "description": "rate-limit attribute",
          "required": false
        },
        {
          "name": "allow-global-wildcard",
          "type": "string",
          "default": "",
          "description": "allow-global-wildcard attribute",
          "required": false
        },
        {
          "name": "debug",
          "type": "string",
          "default": "",
          "description": "debug attribute",
          "required": false
        }
      ],
      "properties": [],
      "methods": [],
      "events": [],
      "slots": [],
      "examples": [],
      "dependencies": [
        "@larcjs/core"
      ],
      "related": []
    },
    {
      "name": "pan-card",
      "displayName": "Pan Card",
      "description": "Pan Card component",
      "category": "ui",
      "path": "../components/src/components/pan-card.mjs",
      "icon": "üÉè",
      "tags": [
        "ui",
        "pan"
      ],
      "status": "stable",
      "since": "1.0.0",
      "attributes": [
        {
          "name": "header",
          "type": "string",
          "default": "",
          "description": "header attribute",
          "required": false
        },
        {
          "name": "footer",
          "type": "string",
          "default": "",
          "description": "footer attribute",
          "required": false
        },
        {
          "name": "variant",
          "type": "string",
          "default": "",
          "description": "variant attribute",